{
  "schema_version": "2.0",
  "generated_at": "2026-09-11T00:00:00Z",
  "source_coverage": [
    {
      "source_id": "example-community-source",
      "source_name": "Example UK immigration community",
      "source_type": "json",
      "source_url": null,
      "coverage_start": "2026-01-01",
      "coverage_end": "2026-09-11",
      "records_processed": 1000,
      "coverage_complete": true
    }
  ],
  "summary": {
    "countries_detected": [
      "United Kingdom"
    ],
    "total_signals": 1,
    "active": 1,
    "monitoring": 0,
    "uncertain": 0,
    "resolved": 0,
    "historical": 0,
    "highest_active_severity": "high"
  },
  "signals": [
    {
      "signal_id": "sig_gbr-gt-endorsement-delay",
      "root_cause_id": "gbr-gt-endorsement-delay",
      "correlated_signal_ids": [],
      "title": "Repeated peer-review endorsement delays beyond the usual window",
      "signal_family": "E2_APPLICATION_PROCESSING",
      "signal_type": "processing_delay",
      "signal_class": "processing",
      "impact_direction": "negative",
      "status": "active",
      "trend": "worsening",
      "severity": "high",
      "confidence": "high",
      "destination": {
        "country": "United Kingdom",
        "country_code": "GBR",
        "region": null,
        "city": null
      },
      "applicant_scope": {
        "origin_countries": [],
        "nationalities": [],
        "residence_countries": [],
        "applying_from": [],
        "age_groups": [],
        "occupations": [],
        "fields": [
          "science",
          "engineering",
          "technology"
        ],
        "education_levels": [],
        "regulated_professions": [],
        "other_conditions": [
          "Global Talent peer-review endorsement applicant"
        ]
      },
      "migration_routes": [
        "global_talent"
      ],
      "migration_route_family": [
        "EMPLOYMENT / WORK"
      ],
      "process_stages": [
        "endorsement_stage_1",
        "peer_review"
      ],
      "entities": [],
      "summary_en": "Several independent recent applicants report materially longer peer-review endorsement waits than the usual published timing.",
      "summary_fa": "چند متقاضی مستقل در گزارش‌های جدید از طولانی‌تر شدن محسوس زمان اندورسمنت Peer Review نسبت به زمان معمول منتشرشده خبر داده‌اند.",
      "practical_impact": "Fixed employment or immigration deadlines may become difficult.",
      "who_should_care": "Applicants using the affected peer-review endorsement path with fixed deadlines.",
      "recommended_action": "Allow a larger timing buffer and verify the latest official processing guidance.",
      "known_workaround": "Avoid non-refundable commitments based only on the nominal timing.",
      "first_seen": "2026-05-01",
      "last_seen": "2026-09-05",
      "last_verified": "2026-09-11",
      "recency_class": "very_current",
      "evidence_count": 4,
      "independent_report_count": 4,
      "officially_confirmed": false,
      "community_confirmed": true,
      "official_verification": {
        "status": "partly_confirmed",
        "source_url": "https://www.gov.uk/global-talent",
        "source_title": "Example official timing source",
        "verified_at": "2026-09-11",
        "note": "Official source confirms the baseline timing but not the full community-observed backlog."
      },
      "suggested_fit_adjustment": -10,
      "conditional_adjustment": {
        "adjustment": -10,
        "apply_when": "The applicant uses the affected peer-review path and an immovable deadline cannot absorb the observed delay."
      },
      "reason_for_adjustment": "Repeated current independent reports create material timing risk, not an approval-probability estimate.",
      "keywords": [
        "Global Talent",
        "peer review",
        "endorsement",
        "delay"
      ],
      "evidence": [
        {
          "evidence_id": "evd_gt-endorsement-delay-1",
          "date": "2026-08-01",
          "source_type": "first_hand_applicant_experience",
          "source_name": "Example UK immigration community",
          "source_url": null,
          "source_message_id": null,
          "evidence_summary": "Applicant reported waiting well beyond the usual endorsement window.",
          "direct_or_second_hand": "direct",
          "supports_or_contradicts": "supports",
          "independence_group": "r1"
        },
        {
          "evidence_id": "evd_gt-endorsement-delay-2",
          "date": "2026-08-20",
          "source_type": "first_hand_applicant_experience",
          "source_name": "Example UK immigration community",
          "source_url": null,
          "source_message_id": null,
          "evidence_summary": "Independent applicant reported a similar extended wait.",
          "direct_or_second_hand": "direct",
          "supports_or_contradicts": "supports",
          "independence_group": "r2"
        },
        {
          "evidence_id": "evd_gt-endorsement-delay-3",
          "date": "2026-09-05",
          "source_type": "first_hand_applicant_experience",
          "source_name": "Example UK immigration community",
          "source_url": null,
          "source_message_id": null,
          "evidence_summary": "Third independent applicant reported the same timing pattern.",
          "direct_or_second_hand": "direct",
          "supports_or_contradicts": "supports",
          "independence_group": "r3"
        },
        {
          "evidence_id": "evd_gt-official-baseline-timing",
          "date": "2026-09-11",
          "source_type": "official_government",
          "source_name": "GOV.UK Global Talent visa guidance",
          "source_url": "https://www.gov.uk/global-talent",
          "source_message_id": null,
          "evidence_summary": "Official guidance publishes the baseline endorsement timing but not the community-observed backlog.",
          "direct_or_second_hand": "direct",
          "supports_or_contradicts": "supports",
          "independence_group": "gov-uk"
        }
      ],
      "resolution": {
        "resolved": false,
        "resolved_date": null,
        "resolution_summary": null,
        "resolution_source": null
      },
      "needs_recheck": true,
      "suggested_recheck_date": "2026-09-25"
    }
  ],
  "watchlist": [],
  "quality_control": {
    "full_sources_processed": true,
    "reply_chains_considered": true,
    "duplicates_merged": true,
    "contradictions_checked": true,
    "resolutions_checked": true,
    "country_scope_checked": true,
    "route_scope_checked": true,
    "institution_scope_checked": true,
    "correlated_penalties_checked": true,
    "personal_identifiers_removed": true
  }
}
